system,category,sensor_input,model_reproducibility,spc_integration,explainability,work_order_workflow,deployment_level,research_reproducibility,reference_url
IBM Maximo,Commercial EAM/APM platform,Enterprise asset and IoT data integration,Product-managed; internal implementation is not a reproducible AI4I experiment,Asset monitoring and analytics capabilities; SPC workflow depends on configuration,Product analytics and AI features vary by deployment,Strong enterprise maintenance workflow,Commercial production platform,Low for public dataset benchmarking,https://www.ibm.com/products/maximo
AWS IoT SiteWise,Industrial IoT data platform,"Industrial data collection, modeling, monitoring, and anomaly detection",Cloud-service workflow; benchmark pipeline is user-defined,Operational metrics and anomaly detection; SPC workflow is not the central research artifact,Depends on user-built analytics layer,Requires integration with maintenance systems,Commercial cloud platform,Medium when users publish their own pipeline,https://aws.amazon.com/iot-sitewise/
Azure IoT Operations,Industrial edge and cloud operations platform,Industrial device/asset connectivity and cloud integration,Cloud/edge service workflow; benchmark model details are user-defined,Supports industrial analytics scenarios; SPC workflow depends on solution design,Depends on connected AI services and custom implementation,Requires integration with business/maintenance applications,Commercial cloud/edge platform,Medium when users publish their own pipeline,https://learn.microsoft.com/en-us/azure/iot-operations/overview-iot-operations
Siemens Insights Hub,Industrial IoT and asset-health platform,Machine/process data ingestion and asset health solutions,Product/solution-managed; public benchmark reproduction is user-defined,"Asset health, maintenance, and quality prediction solutions",Depends on configured solution and AI model,Enterprise workflow depends on integration,Commercial industrial IoT platform,Low to medium for public benchmark comparison,https://www.siemens.com/en-us/products/insights-hub/solutions/
This system,Product MVP and reproducible research pipeline,"CSV upload, local API, file-drop playback, MQTT/OPC UA mock bridge","Full local AI4I split, metrics, SMOTE comparison, threshold tuning, saved artifacts","ML probability, SPC control-chart context, and combined alert comparison",SHAP factor view plus Gemini/OpenAI GenAI manager report,"Human-approved draft, approve/reject/needs_review decision log",Local/product MVP; not a production SaaS deployment,High within the provided code/data/artifacts,Local repository artifacts
